{
  "$schema": "http://json-schema.org/draft-07/schema#",
  "$id": "https://olmstedviz.org/schemas/v1/tree.schema.json",
  "title": "Tree",
  "description": "Phylogenetic tree and possibly ancestral state reconstruction of sequences in a clonal family. Extends AIRR 2.0 with fields for tree topology (newick, nodes with parent/distance) and longitudinal summary statistics.\n",
  "type": "object",
  "required": [
    "newick"
  ],
  "additionalProperties": true,
  "definitions": {
    "timepoint_multiplicity": {
      "title": "Timepoint multiplicity",
      "description": "Multiplicity at a specific time",
      "type": "object",
      "required": [
        "multiplicity",
        "timepoint_id"
      ],
      "properties": {
        "multiplicity": {
          "description": "Number of times sequence was observed at the given timepoint",
          "type": "integer",
          "minimum": 0
        },
        "timepoint_id": {
          "description": "Id associated with the timepoint in question",
          "type": [
            "string",
            "null"
          ]
        }
      },
      "additionalProperties": false
    },
    "node": {
      "title": "Node",
      "description": "Node in a phylogenetic tree",
      "type": "object",
      "required": [
        "sequence_id",
        "sequence_alignment",
        "sequence_alignment_aa"
      ],
      "additionalProperties": true,
      "properties": {
        "sequence_id": {
          "description": "Identifier for this node that matches the id in the newick string",
          "type": "string"
        },
        "node_id": {
          "description": "Alternative identifier for this node",
          "type": "string"
        },
        "parent": {
          "description": "Parent node ID",
          "type": [
            "string",
            "null"
          ]
        },
        "branch_length": {
          "description": "Branch length to parent",
          "type": [
            "number",
            "null"
          ]
        },
        "length": {
          "description": "Branch length (alias for branch_length)",
          "type": [
            "number",
            "null"
          ]
        },
        "distance": {
          "description": "Distance from root",
          "type": [
            "number",
            "null"
          ]
        },
        "sequence_alignment": {
          "description": "Nucleotide sequence alignment, including any indel corrections or spacers",
          "type": "string"
        },
        "sequence_alignment_aa": {
          "description": "Amino acid sequence alignment, including any indel corrections or spacers",
          "type": [
            "string",
            "null"
          ]
        },
        "sample_id": {
          "description": "Sample identifier",
          "type": [
            "string",
            "null"
          ]
        },
        "type": {
          "description": "Type of node (leaf, internal, node, or root)",
          "type": [
            "string",
            "null"
          ],
          "enum": [
            "leaf",
            "node",
            "internal",
            "root",
            null
          ]
        },
        "is_root": {
          "description": "Whether this node is the root",
          "type": [
            "boolean",
            "null"
          ]
        },
        "subtree_size": {
          "description": "Number of descendants",
          "type": [
            "integer",
            "null"
          ]
        },
        "timepoint": {
          "description": "Timepoint identifier",
          "type": [
            "string",
            "null"
          ]
        },
        "timepoint_id": {
          "description": "Timepoint identifier (alternative field name)",
          "type": [
            "string",
            "null"
          ]
        },
        "lbi": {
          "description": "Local branching index",
          "type": [
            "number",
            "null"
          ]
        },
        "lbr": {
          "description": "Local branching ratio",
          "type": [
            "number",
            "null"
          ]
        },
        "affinity": {
          "description": "Binding affinity",
          "type": [
            "number",
            "null"
          ]
        },
        "relative_affinity": {
          "description": "Relative binding affinity",
          "type": [
            "number",
            "null"
          ]
        },
        "affinity_class": {
          "description": "Affinity classification",
          "type": [
            "string",
            "null"
          ]
        },
        "aa_sequence": {
          "description": "Full amino acid sequence",
          "type": [
            "string",
            "null"
          ]
        },
        "junction": {
          "description": "CDR3 junction nucleotide sequence",
          "type": [
            "string",
            "null"
          ]
        },
        "junction_aa": {
          "description": "CDR3 junction amino acid sequence",
          "type": [
            "string",
            "null"
          ]
        },
        "v_call": {
          "description": "V gene assignment",
          "type": [
            "string",
            "null"
          ]
        },
        "d_call": {
          "description": "D gene assignment",
          "type": [
            "string",
            "null"
          ]
        },
        "j_call": {
          "description": "J gene assignment",
          "type": [
            "string",
            "null"
          ]
        },
        "count": {
          "description": "Sequence count",
          "type": [
            "integer",
            "null"
          ]
        },
        "confidence": {
          "description": "Confidence score or bootstrap value",
          "type": [
            "number",
            "null"
          ]
        },
        "multiplicity": {
          "description": "Number of times sequence was observed",
          "type": [
            "integer",
            "null"
          ]
        },
        "cluster_multiplicity": {
          "description": "Cumulative count if sequences were clustered",
          "type": [
            "integer",
            "null"
          ]
        },
        "timepoint_multiplicities": {
          "description": "Multiplicities per timepoint",
          "type": [
            "array",
            "null"
          ],
          "items": {
            "$ref": "#/definitions/timepoint_multiplicity"
          }
        },
        "cluster_timepoint_multiplicities": {
          "description": "Cluster multiplicities per timepoint",
          "type": [
            "array",
            "null"
          ],
          "items": {
            "$ref": "#/definitions/timepoint_multiplicity"
          }
        },
        "scaled_affinity": {
          "description": "Scaled binding affinity (min-max normalized)",
          "type": [
            "number",
            "null"
          ]
        }
      }
    }
  },
  "properties": {
    "ident": {
      "description": "Tree identifier",
      "type": [
        "string",
        "null"
      ]
    },
    "tree_id": {
      "description": "Unique identifier for the tree",
      "type": [
        "string",
        "null"
      ]
    },
    "clone_id": {
      "description": "Identifier for the associated clone",
      "type": [
        "string",
        "null"
      ]
    },
    "timepoint_ids": {
      "description": "Time points included in this tree",
      "type": [
        "array",
        "null"
      ],
      "items": {
        "type": "string"
      }
    },
    "downsampling_strategy": {
      "description": "Method used to downsample sequences before tree inference",
      "type": [
        "string",
        "null"
      ]
    },
    "diversity": {
      "description": "Mean distance from all tree nodes to their most recent common ancestor",
      "type": [
        "number",
        "null"
      ]
    },
    "min_junction_length": {
      "description": "Minimum CDR3 junction nucleotide length",
      "type": [
        "number",
        "null"
      ]
    },
    "max_junction_length": {
      "description": "Maximum CDR3 junction nucleotide length",
      "type": [
        "number",
        "null"
      ]
    },
    "sample_id": {
      "description": "Sample identifier for associated sequences",
      "type": [
        "string",
        "null"
      ]
    },
    "newick": {
      "description": "Tree in Newick format",
      "type": "string"
    },
    "nodes": {
      "description": "Tree nodes as array of node objects or dict keyed by node ID",
      "oneOf": [
        {
          "type": "array",
          "items": {
            "$ref": "#/definitions/node"
          }
        },
        {
          "type": "object",
          "additionalProperties": {
            "$ref": "#/definitions/node"
          }
        }
      ]
    }
  }
}
