{
    "clone_id": "family-1",
    "ident": "522fac7a-4689-e49a-05d1-9353af02f885",
    "newick": "((((1TACAGTGGGATAGTTTCTTGGG:1e-06,1TTCGCTGATATCGCCTCTTGGG:1e-06)Node3:1e-06,Node4:1e-06)Node2:1e-06)Node1:0.034625526)naive:0.0;",
    "nodes": {
        "1TACAGTGGGATAGTTTCTTGGG": {
            "affinity": null,
            "lbi": null,
            "lbr": null,
            "multiplicity": 1,
            "sequence_alignment": "",
            "sequence_alignment_aa": "",
            "sequence_id": "1TACAGTGGGATAGTTTCTTGGG",
            "timepoint_multiplicities": []
        },
        "1TTCGCTGATATCGCCTCTTGGG": {
            "affinity": null,
            "lbi": null,
            "lbr": null,
            "multiplicity": 1,
            "sequence_alignment": "",
            "sequence_alignment_aa": "",
            "sequence_id": "1TTCGCTGATATCGCCTCTTGGG",
            "timepoint_multiplicities": []
        },
        "Node1": {
            "affinity": null,
            "lbi": null,
            "lbr": null,
            "multiplicity": 1,
            "sequence_alignment": "",
            "sequence_alignment_aa": "",
            "sequence_id": "Node1",
            "timepoint_multiplicities": []
        },
        "Node2": {
            "affinity": null,
            "lbi": null,
            "lbr": null,
            "multiplicity": 1,
            "sequence_alignment": "",
            "sequence_alignment_aa": "",
            "sequence_id": "Node2",
            "timepoint_multiplicities": []
        },
        "Node3": {
            "affinity": null,
            "lbi": null,
            "lbr": null,
            "multiplicity": 1,
            "sequence_alignment": "",
            "sequence_alignment_aa": "",
            "sequence_id": "Node3",
            "timepoint_multiplicities": []
        },
        "Node4": {
            "affinity": null,
            "lbi": null,
            "lbr": null,
            "multiplicity": 1,
            "sequence_alignment": "",
            "sequence_alignment_aa": "",
            "sequence_id": "Node4",
            "timepoint_multiplicities": []
        },
        "naive": {
            "affinity": null,
            "lbi": null,
            "lbr": null,
            "multiplicity": 0,
            "sequence_alignment": "",
            "sequence_alignment_aa": "",
            "sequence_id": "naive",
            "timepoint_multiplicities": []
        }
    },
    "tree_id": "pcp-tree-1"
}