{
    "clone_id": "family-7",
    "ident": "38df5d3a-b824-4bde-6380-04ee71f7ed33",
    "newick": "((1TAAACTCGACTATAGTCTTGGG:1e-06,1TACAATGCTATGATTTCTTGGG:1e-06)Node1:0.041436769)naive:0.0;",
    "nodes": [
        {
            "affinity": null,
            "lbi": null,
            "lbr": null,
            "multiplicity": 0,
            "parent": null,
            "sequence_alignment": "CAGGTCCAGCTGGTGCAGTCTGGGGCTGAGGTGAAGAAGCCTGGGTCCTCGGTGAAGGTCTCCTGCAAGGCTTCTGGAGGCACCTTCAGCAGCTATGCTATCAGCTGGGTGCGACAGGCCCCTGGACAAGGGCTTGAGTGGATGGGAGGGATCATCCCTATCTTTGGTACAGCAAACTACGCACAGAAGTTCCAGGGCAGAGTCACGATTACCGCGGACGAATCCACGAGCACAGCCTACATGGAGCTGAGCAGCCTGAGATCTGAGGACACGGCCGTGTATTACTGTGCGAGAGGCCGATTAATAGCCCCCGGGTTCGACCCCTGGGGCCAGGGAACCCTGGTCACCGTCTCCTCA",
            "sequence_alignment_aa": "QVQLVQSGAEVKKPGSSVKVSCKASGGTFSSYAISWVRQAPGQGLEWMGGIIPIFGTANYAQKFQGRVTITADESTSTAYMELSSLRSEDTAVYYCARGRLIAPGFDPWGQGTLVTVSS",
            "sequence_id": "naive",
            "timepoint_multiplicities": [],
            "type": "root"
        },
        {
            "affinity": null,
            "lbi": null,
            "lbr": null,
            "multiplicity": 1,
            "parent": null,
            "sequence_alignment": "CAGGTCCAGCTGGTGCAGTCTGGGGCTGAGGTGAAGAAGCCTGGGTCCTCGGTGAAGGTCTCCTGCAAGGCTTCTGGAGGCACCTTCAACAGTTATGTTATCAGCTGGGTGCGACAGGCCCCTGGACAAGGGCTTGAGTGGGTGGGAGGGATCATCCCTGATCTTGGGATAGTAAATTACGCACAGAAGTTCCAGGGCAGAGTCACGATTACCGCGGACGAATTCACGAGCACAGCCTACATGGAGCTGCGCAGCCTGAGATCTGAGGACACGGCCGTGTATTACTGTGCGAGAGGCCGATTAATAGCCCCCGGGTTCGACCCCTGGGGCCAGGGAACCCTGGTCACCGTCTCCTCA",
            "sequence_alignment_aa": "QVQLVQSGAEVKKPGSSVKVSCKASGGTFNSYVISWVRQAPGQGLEWVGGIIPDLGIVNYAQKFQGRVTITADEFTSTAYMELRSLRSEDTAVYYCARGRLIAPGFDPWGQGTLVTVSS",
            "sequence_id": "Node1",
            "timepoint_multiplicities": [],
            "type": "leaf"
        },
        {
            "affinity": null,
            "lbi": null,
            "lbr": null,
            "multiplicity": 1,
            "parent": null,
            "sequence_alignment": "CAGGTCCAGCTGGTGCAGTCTGGGGCTGAGGTGAAGAAGCCTGGGTCCTCGGTGAAGGTCTCCTGCAAGGCTTCTGGAGGCACCTTCAACAGTTATGTTATCAGCTGGGTGCGACAGGCCCCTGGACAAGGGCTTGAGTGGGTGGGAGGGATCATCCCTGATCTTGGGATAGTAAATTACGCACAGAAGTTCCAGGGCAGAGTCACGATTACCGCGGACGAATTCACGAGCACAGCCTACATGGAGCTGCGCAGCCTGAGATCTGAGGACACGGCCGTGTATTACTGTGCGAGAGGCCGATTAATAGCCCCCGGGTTCGACCCCTGGGGCCAGGGAACCCTGGTCACCGTCTCCTCA",
            "sequence_alignment_aa": "QVQLVQSGAEVKKPGSSVKVSCKASGGTFNSYVISWVRQAPGQGLEWVGGIIPDLGIVNYAQKFQGRVTITADEFTSTAYMELRSLRSEDTAVYYCARGRLIAPGFDPWGQGTLVTVSS",
            "sequence_id": "1TAAACTCGACTATAGTCTTGGG",
            "timepoint_multiplicities": [],
            "type": "leaf"
        },
        {
            "affinity": null,
            "lbi": null,
            "lbr": null,
            "multiplicity": 1,
            "parent": null,
            "sequence_alignment": "CAGGTCCAGCTGGTGCAGTCTGGGGCTGAGGTGAAGAAGCCTGGGTCCTCGGTGAAGGTCTCCTGCAAGGCTTCTGGAGGCACCTTCAACAGTTATGTTATCAGCTGGGTGCGACAGGCCCCTGGACAAGGGCTTGAGTGGGTGGGAGGGATCATCCCTGATCTTGGGATAGTAAATTACGCACAGAAGTTCCAGGGCAGAGTCACGATTACCGCGGACGAATTCACGAGCACAGCCTACATGGAGCTGCGCAGCCTGAGATCTGAGGACACGGCCGTGTATTACTGTGCGAGAGGCCGATTAATAGCCCCCGGGTTCGACCCCTGGGGCCAGGGAACCCTGGTCACCGTCTCCTCA",
            "sequence_alignment_aa": "QVQLVQSGAEVKKPGSSVKVSCKASGGTFNSYVISWVRQAPGQGLEWVGGIIPDLGIVNYAQKFQGRVTITADEFTSTAYMELRSLRSEDTAVYYCARGRLIAPGFDPWGQGTLVTVSS",
            "sequence_id": "1TACAATGCTATGATTTCTTGGG",
            "timepoint_multiplicities": [],
            "type": "leaf"
        }
    ],
    "tree_id": "pcp-tree-7"
}